{
  "schemaVersion": "1.0",
  "source": "fixture:synthetic-coolant-high",
  "dataMode": "SYNTHETIC",
  "vehicleProfile": "BMW_E46_320Ci_M54B22_MS43_OFFLINE",
  "ecu": "MS430DS0",
  "job": null,
  "capturedAtUtc": "2026-01-01T00:05:00Z",
  "durationMs": 0,
  "values": [
    {
      "rawFieldName": "STAT_MOTORDREHZAHL_WERT",
      "normalizedName": "engine.speed",
      "value": 820,
      "unit": "1/min",
      "validity": "synthetic",
      "sourceJob": "STATUS_MOTORDREHZAHL",
      "mappingStatus": "mapped"
    },
    {
      "rawFieldName": "STAT_MOTORTEMPERATUR_WERT",
      "normalizedName": "engine.coolantTemperature",
      "value": 118,
      "unit": "\u00b0C",
      "validity": "synthetic",
      "sourceJob": "STATUS_MOTORTEMPERATUR",
      "mappingStatus": "mapped"
    },
    {
      "rawFieldName": "STAT_UBATT_WERT",
      "normalizedName": "electrical.batteryVoltage",
      "value": 13.7,
      "unit": "Volt",
      "validity": "synthetic",
      "sourceJob": "STATUS_UBATT",
      "mappingStatus": "mapped"
    }
  ],
  "missingFields": [],
  "errors": [],
  "runtimeVerified": false,
  "fixture": {
    "id": "synthetic-coolant-high",
    "label": "Erhoehte Kuehlmitteltemperatur",
    "disclaimer": "Kuenstliche Testdaten. Keine Messwerte eines realen Fahrzeugs."
  }
}
