{
  "schemaVersion": "1.0",
  "source": "fixture:synthetic-incomplete",
  "dataMode": "SYNTHETIC",
  "vehicleProfile": "BMW_E46_320Ci_M54B22_MS43_OFFLINE",
  "ecu": "MS430DS0",
  "job": null,
  "capturedAtUtc": "2026-01-01T00:15:00Z",
  "durationMs": 0,
  "values": [
    {
      "rawFieldName": "STAT_MOTORDREHZAHL_WERT",
      "normalizedName": "engine.speed",
      "value": 760,
      "unit": "1/min",
      "validity": "synthetic",
      "sourceJob": "STATUS_MOTORDREHZAHL",
      "mappingStatus": "mapped"
    },
    {
      "rawFieldName": "STAT_MOTORTEMPERATUR_WERT",
      "normalizedName": "engine.coolantTemperature",
      "value": 91,
      "unit": "\u00b0C",
      "validity": "synthetic",
      "sourceJob": "STATUS_MOTORTEMPERATUR",
      "mappingStatus": "mapped"
    }
  ],
  "missingFields": [
    "STAT_UBATT_WERT",
    "STAT_LMM_MASSE_WERT",
    "STAT_LAMBDA_ADD_1_WERT",
    "STAT_LAMBDA_MUL_1_WERT"
  ],
  "errors": [],
  "runtimeVerified": false,
  "fixture": {
    "id": "synthetic-incomplete",
    "label": "Unvollstaendiger Datensatz",
    "disclaimer": "Kuenstliche Testdaten. Fehlende Werte werden nicht ersetzt."
  }
}
