{
  "schemaVersion": "1.0",
  "source": "fixture:synthetic-normal",
  "dataMode": "SYNTHETIC",
  "vehicleProfile": "BMW_E46_320Ci_M54B22_MS43_OFFLINE",
  "ecu": "MS430DS0",
  "job": null,
  "capturedAtUtc": "2026-01-01T00:00:00Z",
  "durationMs": 0,
  "values": [
    {
      "rawFieldName": "STAT_MOTORDREHZAHL_WERT",
      "normalizedName": "engine.speed",
      "value": 760,
      "unit": "1/min",
      "validity": "synthetic",
      "sourceJob": "STATUS_MOTORDREHZAHL",
      "mappingStatus": "mapped"
    },
    {
      "rawFieldName": "STAT_UBATT_WERT",
      "normalizedName": "electrical.batteryVoltage",
      "value": 13.9,
      "unit": "Volt",
      "validity": "synthetic",
      "sourceJob": "STATUS_UBATT",
      "mappingStatus": "mapped"
    },
    {
      "rawFieldName": "STAT_MOTORTEMPERATUR_WERT",
      "normalizedName": "engine.coolantTemperature",
      "value": 92,
      "unit": "\u00b0C",
      "validity": "synthetic",
      "sourceJob": "STATUS_MOTORTEMPERATUR",
      "mappingStatus": "mapped"
    },
    {
      "rawFieldName": "STAT_LMM_MASSE_WERT",
      "normalizedName": "intake.airMass",
      "value": 14.5,
      "unit": "kg/h",
      "validity": "synthetic",
      "sourceJob": "STATUS_LMM_MASSE",
      "mappingStatus": "mapped"
    },
    {
      "rawFieldName": "STAT_LAMBDA_ADD_1_WERT",
      "normalizedName": "mixture.bank1AdditiveAdaptation",
      "value": 0.05,
      "unit": "ms",
      "validity": "synthetic",
      "sourceJob": "STATUS_LAMBDA_ADD_1",
      "mappingStatus": "mapped"
    },
    {
      "rawFieldName": "STAT_LAMBDA_MUL_1_WERT",
      "normalizedName": "mixture.bank1MultiplicativeAdaptationPercent",
      "value": 0.8,
      "unit": "%",
      "validity": "synthetic",
      "sourceJob": "STATUS_LAMBDA_MUL_1",
      "mappingStatus": "mapped"
    }
  ],
  "missingFields": [],
  "errors": [],
  "runtimeVerified": false,
  "fixture": {
    "id": "synthetic-normal",
    "label": "Unauffaelliger Datensatz",
    "disclaimer": "Kuenstliche Testdaten. Keine Messwerte eines realen Fahrzeugs."
  }
}
